采后水杨酸处理对早酥梨果实色泽和质地的影响	王军节;毕阳;范存婓;张婷婷;张智宏;符瑞娟;刘衍斌	《现代食品科技》	甘肃农业大学食品科学与工程学院;西北民族大学生命科学与工程学院;	2010	梨;水杨酸;色泽;质地多面分析
中国核心优势产区玉米生产效率增长及其分解分析	王军;徐晓红;王洪丽;姚凤桐	《玉米科学》	吉林省农业科学院;内蒙古农业大学;	2010	玉米;全要素生产率;随机前沿分析;玉米优势产区
显微CT与组织切片技术在骨形态计量研究中的比较	王军;毕龙;白建萍;吕荣;杨彬奎	《中国矫形外科杂志》	第四军医大学西京骨科医院骨科实验室;	2009	骨形态计量;显微CT;组织切片
软开关技术在磁悬浮轴承功率放大器中的应用	王军;徐龙祥	《电工技术学报》	南京航空航天大学机电学院;	2009	磁悬浮轴承;软开关;功率放大器;三电平;并联谐振
完善经济发展方式转变的动力问题研究	王军	《理论学刊》	中共山东省委党校经济学教研部;	2009	经济发展方式转变;三重动力;政府改革
电感耦合等离子体质谱测量硒的研究进展	王军;刘丛强;王莹莹	《质谱学报》	中国科学院地球化学研究所;中国科学院研究生院;中国计量科学研究院;北京化工大学理学院;	2008	电感耦合等离子体质谱;硒;同位素
再生混凝土强度和耐久性能试验	王军强;陈年和;蒲琪	《混凝土》	徐州建筑学院	2007	再生骨料;再生混凝土;试验研究;强度;冻融耐久性
石板坡长江大桥钢混结合段局部应力分析	王军文;倪章军;李建中;孙峻岭	《公路交通科技》	石家庄铁道学院土木工程分院	2007	桥梁工程;钢混结合段;有限元;局部应力;连续刚构
木本植物基因组DNA提取及鉴定	王军;杨传平;刘桂丰	《植物研究》	东北林业大学林学院	2006	木本植物;基因组DNA;提取
桥梁中抗震限位装置设计方法的研究	王军文;李建中;范立础	《土木工程学报》	石家庄铁道学院	2006	地震;桥梁;碰撞;限位装置;设计方法;地震反应
土地质量发展趋势对我国土地整理研究的启示	王军	《地域研究与开发》	国土资源部土地整理中心国土整治研究室	2006	土地质量;土地整理;土地退化;土地资源
论间接回指的释义基础	王军	《外语教学》	聊城大学外国语学院	2003	间接回指;关联;适量激活;框架
梁陈方案的历史考察  谨以此文纪念梁思成诞辰100周年并悼念陈占祥逝世	王军	《城市规划》	新华社北京分社	2001	陈占祥;梁思成;城市规划;行政中心;历史考察;诞辰周年;中心区;城市建设;北京市;都市计划
数字图书馆的研究内容和方向	王军;杨冬青;唐世渭	《中国图书馆学报》	北京大学信息管理系	2001	数字图书馆;美国数字图书馆启动计划;研究内容;研究方向
有氧运动对大鼠脑衰老和学习记忆能力及额叶GAP-43表达的影响	王军威	《成都体育学院》	 	2017	有氧运动;衰老;学习记忆;额叶;GAP-43
现代国家建构遭遇民族文化:国外学界三个维度的考察	王军;王阳	《黑龙江民族丛刊》	中央民族大学;	2017	民族;国家建构;民族文化;少数民族
计算机辅助骨科手术技术将改善股骨颈骨折治疗	王军强;樊瑜波	《中国骨伤》	北京航空航天大学生物医学工程学院;北京积水潭医院创伤骨科;	2018	机器人手术;外科手术;计算机辅助;股骨颈骨折
上调GDF-15表达对H_2O_2诱导的H9C2心肌细胞生物学特性及PI3K/AKT信号通路的影响	王军;张松林;和旭梅;何璐;范粉灵	《中国免疫学杂志》	西安交通大学第一附属医院结构性心脏病科	2018	GDF-;H_O_;心肌细胞;增殖;凋亡;PIK/AKT信号通路
历史与主权:驳印度关于藏南领土主权的四项依据	王军杰;崔哲嘉	《山东警察学院学报》	四川大学法学院	2018	藏南地区;麦克马洪线;领土主权;时效原则;实际控制
桥墩墩型对平衡冰塞水位影响的试验研究	王军;黄宁静;吴一帆;程铁杰	《水科学进展》	合肥工业大学土木与水利工程学院	2018	桥墩墩型;平衡冰塞水位;弗劳德数;冰塞壅水;试验研究
历史学科核心素养下的史料运用探索	王军海	《中学历史教学参考》	广东省汕头市潮阳第一中学	2018	学科核心素养;史料运用;中学生;
论欧盟农业国内支持制度的演进及晚近发展趋势	王军杰;申莉萍	《财经理论与实践》	四川大学法学院;成都市人民检察院公诉二处;	2017	欧盟;国内支持;CAP
灾害风荷载下温室单层柱面网壳整体动力倒塌分析	王军林;郭华;任小强;孙建恒	《农业工程学报》	河北农业大学城乡建设学院;	2017	温室;模型;荷载;单层柱面网壳;风荷载;动力倒塌
微波加热催化反应低温制备β-SiC粉体	王军凯;张远卓;李俊怡;张海军;李发亮;韩磊;宋述鹏	《无机材料学报》	武汉科技大学省部共建耐火材料与冶金国家重点实验室;	2017	β-SiC;微波加热;催化反应;密度泛函理论
腹腔镜手术治疗重症急性胰腺炎及对TNF-α、IL-6和sIL-2R水平的影响	王军锋;李娜;罗卿	《中国内镜杂志》	核工业四一七医院检验科;西安交通大学第一附属医院检验科;核工业四一七医院外一科;	2017	重症急性胰腺炎;腹腔镜手术;肿瘤坏死因子-α(TNF-α);白细胞介素-(IL-);可溶性白细胞介素-受体(sIL-R)
马克思主义正义观视角下的税收正义问题研究	王军	《税务研究》	国家税务总局所得税司;	2017	马克思主义;正义观;税收正义
番薯片热风与微波联合干燥特性及品质评价	王军;程晶晶;牛亚冰	《食品工业科技》	许昌学院食品与生物工程学院;	2016	番薯片;热风干燥;微波干燥;联合干燥;干燥模型;品质评价
不同温光条件下水稻抽穗期QTL的定位与分析	王军;朱金燕;周勇;杨杰;范方军;李文奇;王芳权;仲维功;梁国华	《中国水稻科学》	扬州大学江苏省粮食作物现代产业技术协同创新中心/教育部植物功能基因组学重点实验室;江苏省农业科学院粮食作物研究所/国家水稻改良中心南京分中心;	2016	水稻;染色体单片段代换系;数量性状基因座;抽穗期;代换作图
新形势下高校公用房管理问题与对策研究	王军;汪海;李姗珊	《中央财经大学学报》	中央财经大学资产管理处;	2015	新形势;高校公用房;管理;问题;对策
微课在中职“计算机应用基础”课程教学中的应用探讨	王军	《职教通讯》	江苏省泗洪中等专业学校;	2014	中职;微课;计算机应用基础;课程教学
基于空间距离的快速模糊C均值聚类算法	王军玲;王士同;包芳;周建林	《计算机工程与应用》	江南大学数字媒体学院;江苏省信息融合软件工程技术研发中心;江苏省江阴职业技术学院计算机科学系;	2015	模糊C均值聚类;空间距离;鲁棒性
基于改进分数阶黏滞体的岩石非线性蠕变模型	王军保;刘新荣;王铁行	《中南大学学报(自然科学版)》	西安建筑科技大学土木工程学院;重庆大学土木工程学院;	2015	岩石;蠕变模型;改进的分数阶黏滞体;非线性黏滞体
二醇酯类内给电子体丙烯聚合反应催化剂的研究进展	王军;刘海涛;刘月祥;周奇龙;李昌秀;高明智	《化工进展》	中国石油化工股份有限公司北京化工研究院;	2015	催化剂;内给电子体;二醇酯;聚合物
作为社会系统的翻译——《卢曼社会学理论在翻译研究中的应用》评介	王军平	《外语教学理论与实践》	哈尔滨工业大学;复旦大学;	2015	翻译社会学;翻译系统;社会系统理论
政府所有权、市场化程度和高管与员工薪酬差距——基于沪深A股上市公司的数据	王军	《财经问题研究》	东北财经大学金融学院;安徽财经大学金融学院;	2014	政府所有权;高管与员工薪酬差距;市场化程度
铋系光催化剂的最新研究进展	王军;伍水生;赵文波;廉培超;王亚明	《化工科技》	昆明理工大学化学工程学院;	2014	铋系光催化剂;钨酸铋;光催化活性;研究进展
继续简政放权:新愿景、新动力、新路径	王军	《哈尔滨市委党校学报》	中共中央党校;	2014	简政放权;共同愿景;改革动力;改革路径
基于ZigBee的蔬菜大棚无线监控系统设计	王军;孙健程;曾静	《计算机工程与设计》	沈阳化工大学计算机科学与技术学院;沈阳化工大学信息工程学院;	2013	监控系统;蔬菜大棚;无线传感器网络;ZigBee;CC
一种基于Census变换的可变权值立体匹配算法	王军政;朱华健;李静	《北京理工大学学报》	北京理工大学复杂系统智能控制与决策教育部重点实验室;	2013	立体匹配;Census变换;可变权值;最小均匀度子邻域
商业银行核心竞争力评价的指标体系构建与运用	王军	《统计与决策》	安徽财经大学金融系;	2011	商业银行;核心竞争力;指标体系
季铵盐双子表面活性剂的合成和表面活性	王军;栾立辉;杨许召;李刚森	《精细化工》	郑州轻工业学院河南省表界面科学重点实验室;	2009	季铵盐;双子表面活性剂;表面张力;表面活性剂
双向激振下饱和软黏土应变软化现象试验研究	王军;蔡袁强;潘林有	《岩土工程学报》	温州大学建筑与土木工程学院;浙江大学岩土工程研究所;	2009	软化;双向激振循环荷载;初始剪应力;门槛径向循环应力比;应力–应变
降雨入渗对流变介质隧道边坡稳定性的分析	王军;曹平;李江腾;刘业科	《岩土力学》	中南大学资源与安全工程学院;	2009	边坡工程;偏压隧道;有限差分;渗流分析;流变分析
多项式0-1规划中隐枚举算法的改进及应用	王军;李端	《系统工程理论与实践》	青岛大学管理科学与工程系	2007	非线性整数规划;-规划;隐枚举算法;组合优化
健全我国行政决策机制的若干问题	王军	《中共中央党校学报》	中共中央党校政治学法学教研部	2006	行政决策;决策机制;决策过程;决策行为;决策责任
膨胀砂岩的抗剪强度与含水量的关系	王军;何淼;汪中卫	《土木工程学报》	江苏省交通科学研究院	2006	膨胀岩;抗剪强度;含水量;直剪试验;凝聚力;内摩擦角
我国静脉产业的发展现状及今后的主要工作	王军;岳思羽;乔琦	《环境保护》	青岛理工大学	2006	静脉产业;生态工业园区;发展现状;城市生活垃圾;主要问题;环境安全;动脉产业;工业固体废物;规模化;资源化
抗菌肽抗菌机理的研究现状及趋势	王军;庞广昌	《食品科学》	天津商学院生物工程系	2005	抗菌肽;抗菌机理;研究进展
发展中国家对外直接投资的成功经验及其对中国的启示	王军;高国威;刘育明	《世界地理研究》	保定师范专科学校资源与环境系	2003	发展中国家;跨国公司;对外直接投资;企业国际化
循环经济:可持续发展战略的新探索	王军;王文兴;刘金华	《中国人口.资源与环境》	青岛市环保局	2002	循环经济;可持续发展;生态环境;废物处理
代孕的合法性论证及立法规制建议	王军霞	《华东政法大学》	 	2016	代孕合法性;身份契约;亲子关系认定;立法规制
亳州药市及药材种植业发展沿革考	王军;彭华胜;彭代银;刘耀武;方成武	《中药材》	安徽省中医药科学院亳州中医药研究所;亳州职业技术学院药学院;安徽中医药大学药学院;	2017	亳州;药材市场;药材种植;历史
文化—互动范式:跨文化视角下高校英语教学改革研究	王军霞;陈会军	《黑龙江高教研究》	燕京理工学院;中国地质大学;	2018	跨文化;高校英语;教学改革;文化自觉
土质心墙坝水力劈裂试验研究进展	王军玺;陈金淑;陶虎;石喜	《应用基础与工程科学学报》	兰州交通大学土木工程学院;兰州理工大学理学院;	2018	水力劈裂;室内试验;现场试验;模型试验;土质心墙坝
东北地区青年女性腰臀部体型特征与分类	王军;李晓久;潘力;姚彤;于佐君	《纺织学报》	天津工业大学艺术与服装学院	2018	东北地区青年女性;腰臀部体型;因子分析;体型特征
基于ABAQUS和正交试验的隧道围岩稳定性分析	王军祥;孙姣姣;陈四利	《沈阳工业大学学报》	沈阳工业大学建筑与土木工程学院	2018	地铁隧道;数值模拟;正交试验;三维模型;应力场;位移场;极差法;方差法
考虑热力耦合的橡胶减振器阻尼特性	王军;孙大刚;刘世忠;李占龙;章新	《振动.测试与诊断》	太原科技大学机械工程学院	2018	橡胶减振器;阻尼特性;热力耦合;刚度;有限元
马克思共享思想的理论价值和时代意义	王军旗;吴昊	《贵州省党校学报》	国防大学	2018	马克思;共享思想;理论价值;时代意义
滴灌玉米根系生长动态对灌水量响应的试验研究	王军;李久生;栗岩峰;郝锋珍;仇振杰	《排灌机械工程学报》	中国水利水电科学研究院流域水循环模拟与调控国家重点实验室	2018	根系生长;滴灌;补偿性根系吸水;根长密度;水分亏缺
汶川地震前井水温度异常信息的识别及其特征	王军;何案华;赵刚;邓卫平;车用太	《中国地震》	中国地震台网中心	2018	汶川地震;水温;前兆异常
离子液体表面活性剂的合成与应用(Ⅰ)——离子液体表面活性剂的结构和分类	王军;王萍;杨许召;邹文苑;徐清杰	《日用化学工业》	郑州轻工业学院;	2017	表面活性剂;离子液体;结构;分类
推拿结合下颈段抗阻运动治疗颈型颈椎病的临床观察	王军;崔征宇;陈建宏	《针灸临床杂志》	黑龙江中医药大学附属第一医院;黑龙江中医药大学;	2016	推拿;下颈段抗阻运动;颅颈角;颈型颈椎病
孔结构对热解酚醛树脂制备碳纳米管的影响	王军凯;张海军;梁峰;谭操;李赛赛;宋健波;韩磊;黄珍霞	《硅酸盐学报》	武汉科技大学省部共建耐火材料与冶金国家重点实验室;	2017	碳纳米管;孔结构;酚醛树脂;催化剂
有限导流压裂水平气井拟稳态产能计算及优化	王军磊;贾爱林;位云生;赵文琪	《中国石油大学学报(自然科学版)》	中国石油勘探开发研究院;	2016	水平井;有限导流;拟稳态;无量纲产能系数;参数优化
封冻期冰塞堆积演变的试验研究	王军;章宝平;陈胖胖;刘涛	《水利学报》	合肥工业大学;中水东北勘测设计研究有限责任公司;	2016	冰塞;堆积顺序;水力增厚;力学增厚;水槽试验
利用隶属函数法对8种不同石竹属材料主要观赏性状的综合评价	王军娥;薛晋轩;景维坤;亢秀萍	《山西农业大学学报(自然科学版)》	山西农业大学园艺学院;	2016	石竹属;观赏性状;评价;隶属函数法
孔隙岩样动电特性的实验研究	王军;胡恒山;关威;尹诚刚	《地球物理学报》	哈尔滨工业大学航天学院;	2016	动电效应;动电测井;流动电势;渗透率
《山河故人》中的跨文化冲突与故乡认同	王军伟	《当代电影》	浙江大学宁波理工学院传媒与设计学院;	2016	跨文化冲突;故乡认同;《山河故人》
建筑室内健康要求与新风量标准	王军	《制冷与空调(四川)》	四川大学建筑与环境学院;	2016	室内空气品质;室内健康;新风量标准
家用老人智能药箱的无障碍人因设计	王军;邓明明;高贺云;宁奎伟	《包装工程》	西安财经学院;西安交通大学;陕西科技大学;	2015	人因工程;无障碍设计;人机界面;智能药箱;老人
外界载荷对圆柱涡激振动能量转换的影响	王军雷;冉景煜;张智恩;张力;蒲舸;丁林	《浙江大学学报(工学版)》	重庆大学低品位能源利用技术及系统教育部重点实验室;	2015	圆柱绕流;涡激振动;三相耦合;反馈;能量转换
超高效液相色谱-大体积流通池荧光法检测奶及奶制品中的黄曲霉毒素M_1	王军淋;蔡增轩;任一平	《浙江大学学报(农业与生命科学版)》	浙江工业大学化学工程与材料学院;浙江省疾病预防控制中心;	2013	黄曲霉毒素M;超高效液相色谱仪;大体积流通池;荧光检测;沉淀蛋白
基于关键字驱动的自动化测试研究与实现	王军;孟凡鹏	《计算机工程与设计》	南京信息工程大学网络信息中心;南京信息工程大学计算机与软件学院;南京信息工程大学江苏省网络监控中心;	2012	软件测试;关键字驱动;自动化测试;自动化测试框架;回归测试
超声造影在卵巢良恶性肿块鉴别诊断中的应用	王军燕;崔秋丽;汪龙霞;刘爱军;高学文;袁志仙;林倩;徐虹;李秀丽;李卫平;陈小英	《中华医学超声杂志(电子版)》	解放军总医院超声科;解放军总医院病理科;解放军总医院妇产科;	2010	超声检查;造影剂;卵巢肿瘤
伊犁盆地库捷尔太铀矿床层间氧化带与铀矿化特征研究	王军;耿树方	《中国地质》	中国地质科学院地质研究所;	2009	伊犁盆地;库捷尔太铀矿床;层间氧化带;可地浸砂岩
石油金融化与我国石油金融战略体系的构建	王军	《宏观经济研究》	特华博士后科研工作站;	2009	石油金融化;石油安全;石油金融战略体系
基于灰色关联度的建筑供应商选择方法研究	王军武;呙淑文	《武汉理工大学学报》	武汉理工大学土木工程与建筑学院	2007	建筑供应链;灰色关联度;建筑供应商选择;熵
基于响应曲面法的苦荞麸皮总黄酮提取工艺优化	王军;王敏;于智峰;郑慧;周海燕	《农业机械学报》	西北农林科技大学食品科学与工程学院	2007	苦荞麸皮;总黄酮;提取;响应曲面法;优化
结构性软土地基施工扰动定量分析	王军;高玉峰;高红珍	《岩土力学》	河海大学岩土工程研究所	2005	结构性;软粘土;地基处理;扰动度
基于组件的设备管理信息系统的研究与实现	王军强;孙树栋;柴永生;司书宾	《计算机集成制造系统-CIMS》	西北工业大学机电工程学院	2004	设备管理信息系统;组件;重用;客户机/服务器;三层体系结构
应用指数和法对潮土农田土壤肥力变化的评价研究	王军艳;张凤荣;王茹;贾小红;张彩月	《农村生态环境》	中国农业大学土地资源系!北京100094	2001	北京平原;土壤肥力变化;指数和法评价
黄土丘陵小流域土地利用结构对土壤水分时空分布的影响	王军;傅伯杰	《地理学报》	中国科学院生态环境研究中心!北京100085	2000	黄土丘陵区;土壤水分;土地利用结构;土地利用类型
渤海蓬莱9-1油田强烈生物降解原油油源对比	王军;周心怀;杨波;王清斌;郭永华;王飞龙	《中国海上油气》	中海石油(中国)有限公司天津分公司;中海石油(中国)有限公司上海分公司;	2017	生物降解;油源对比;稠油油藏;蓬莱-油田;渤海
高校实验室使用激光的安全管理	王军;李金玲;高萌	《实验室研究与探索》	山东农业大学资源与环境学院山东省高校农业环境重点实验室;	2017	激光;高校实验室;激光安全;激光危害;防范措施
大蒜与3种药用作物对烟草炭疽病菌的抑菌效果	王军;何大敏;陈廷智;杨水平;陈阳;刘京;张东艳;丁伟	《西南大学学报(自然科学版)》	贵州省烟草公司遵义市公司;西南大学资源环境学院;	2018	烟草炭疽病菌;药用作物;提取物;根系分泌物;抑菌性
断层破碎带巷道基于钢管混凝土支架的复合支护技术研究及应用	王军;王正泽;丁厚刚;郭毕钧;顾薛青	《隧道建设(中英文)》	山东建筑大学土木工程学院;山东英才学院建筑工程学院;山东深博巷道支护技术有限公司;	2018	巷道支护;断层破碎带;承压环强化支护方法;钢管混凝土支架;复合支护技术
阿尔金山东段阿克塞蛇绿岩地质地球化学特征及形成时代	王军;李小强;梁明宏;王玉玺;张兵兵;潘保田	《地质通报》	兰州大学资源环境学院西部环境教育部重点实验室	2018	蛇绿岩;阿尔金山东段;地球化学;锆石U-Pb年代学
内配钢筋钢管混凝土构件轴心受拉性能研究	王军;董建尧;赵建;陈驹	《钢结构》	浙江大学建筑工程学院	2018	内配钢筋;钢管混凝土;轴拉试验;有限元模型;承载力计算式
水上重大溢油事故围油栏协同调度方法研究	王军;杜剑;王美蓉	《运筹与管理》	大连海事大学交通运输工程学院	2018	水上重大溢油事故;环境敏感资源;待围控区域;围油栏协同调度;应急调度效果
MRI对糖尿病肛管直肠周围感染的诊断价值	王军大;张桢;杨华;方玉;刘映江;吴青青;梅秀婷;李艳艳	《解放军医学杂志》	重庆市中医院放射科	2018	糖尿病;肛管直肠病变;肛瘘;磁共振成像
“肥胖悖论”现象辨析及其应对策略	王军利;项立敏	《医学争鸣》	中国矿业大学体育学院	2018	肥胖悖论;现象学;流行病;健康促进
高校后勤餐饮成本管理优化研究及应用	王军;王芳兰	《中国市场》	西安财经学院信息学院	2018	成本控制;标准成本;流程优化;组织创新;智慧餐饮
水平小圆管内超临界二氧化碳对流传热特性的试验研究	王军辉;郭鹏程;颜建国;朱凤岭;罗兴锜	《西安理工大学学报》	西安理工大学省部共建西北旱区生态水利国家重点实验室	2018	超临界二氧化碳;对流传热;传热关联式;超临界流体
DNA甲基化参与LPS诱导的牛子宫内膜细胞IL-6和IL-8表达调控	王军;燕晓晓;丁赫;吕文发	《中国兽医学报》	吉林农业大学动物科技学院/吉林省反刍动物繁育生物技术与健康养殖工程实验室	2018	LPS;子宫内膜细胞;DNA甲基化;IL-;IL-
法舒地尔对胃癌MGC-803细胞增殖、侵袭和迁移的影响	王军;马幸	《临床肿瘤学杂志》	郑州市第七人民医院药学部	2018	胃癌;法舒地尔;迁移;侵袭;基质金属蛋白酶;血管内皮生长因子
大鼠增殖抑制基因过表达对C6胶质瘤细胞侵袭的抑制作用及其机制探讨	王军成;邹有瑞;吴桥;霍国进;蒋树财;高鹏;夏明;沈冰	《肿瘤》	宁夏医科大学临床医学院;宁夏医科大学宁夏颅脑疾病重点实验室;宁夏医科大学总医院神经外科;榆林市第一医院神经外科;滨州市人民医院神经外科;徐州市肿瘤医院神经外科;	2017	神经胶质瘤;基因表达调控;肿瘤;细胞运动;Rho相关激酶类;增殖抑制基因
加快构建具有中国特色的直接税制度	王军昆	《税务研究》	云南省国家税务局;	2017	中国特色;直接税;收入分配
混合分布在非一致性水文频率分析中的应用	王军;宁亚伟;胡义明;刘和昌;梁忠民	《南水北调与水利科技》	河海大学水文水资源学院;水利部珠江水利委员会技术咨询中心;水安全与水科学协同创新中心;	2017	非一致性;水文频率分析;混合分布;淮河流域
焦磷酸根离子传感体系的研究进展	王军;初紅涛;陈微微;孙荣国	《有机化学》	贵州师范大学化学与材料科学学院;齐齐哈尔大学化学与化学工程学院;	2016	焦磷酸根离子;传感体系;竞争检测;金纳米粒子;聚集体
淋巴细胞亚群失衡与EV71型手足口病重症化的相关性	王军;邓慧玲;袁娟;张玉凤;李亚萍;李梅;王文俊;高宁;党双锁	《中华实验和临床感染病杂志(电子版)》	西安交通大学第二附属医院感染科;西安市儿童医院感染二科;	2017	手足口病;肠道病毒型;免疫功能;淋巴细胞亚群;细胞因子
WiFi通信技术在煤矿信息化中的应用分析	王军;顾义东;曾苛	《工矿自动化》	甘肃省安全生产科学研究院;中煤科工集团常州研究院有限公司;天地(常州)自动化股份有限公司;天地科技股份有限公司上海分公司;	2017	煤矿信息化;矿井通信;无线通信;WiFi通信;应急通信
环境税国际协调法律制度障碍及解决途径研究	王军;邢文达	《河北法学》	对外经济贸易大学法学院;	2017	环境税;国际协调法律制度;边境税;能源税指令;环境政策一体化
基于重测序的染色体片段代换系定位水稻抽穗期QTL	王军;朱金燕;陶亚军;周勇;范方军;李文奇;王芳权;仲维功;杨杰;梁国华	《中国水稻科学》	扬州大学江苏省粮食作物现代产业技术协同创新中心/教育部植物功能基因组学重点实验室;江苏省农业科学院粮食作物研究所/国家水稻改良中心南京分中心;	2017	水稻;染色体片段代换系;重测序;抽穗期
争论中的国族与国族建构:内涵、路径与评价	王军;王阳	《中央社会主义学院学报》	中央民族大学;	2017	中华民族;共同体;国族;国族建构
碳纳米管增强碳复合耐火材料的研究进展	王军凯;邓先功;张海军;李发亮;宋健波;田亮;张少伟	《耐火材料》	武汉科技大学省部共建耐火材料与冶金国家重点实验室;	2016	碳纳米管;碳复合耐火材料;催化;酚醛树脂
顾客抱怨行为及其影响因素研究述评	王军;江若尘	《科学经济社会》	上海财经大学国际工商管理学院;上海财经大学上海发展研究院;	2016	消费者行为;顾客抱怨;顾客满意
