美拉德反应对金带细鲹鱼肉蛋白酶解物体内抗氧化性的影响	王军;王忠合;傅力;卢彬	《现代食品科技》	韩山师范学院生命科学与食品科技学院;新疆农业大学食品科学与药学学院;	2017	金带细鲹;美拉德反应;脂质过氧化;肝脏;小鼠
全膝关节置换术后被动与主动活动康复的比较	王军霞	《中国矫形外科杂志》	河南安阳市人民医院骨一科;	2017	膝关节置换;早期康复训练;被动活动;主动活动
反气相色谱测定非对称双阳离子型离子液体的溶解度参数	王军;杨许召;武金超;宋浩;邹文苑	《色谱》	郑州轻工业学院材料与化学工程学院;	2015	反气相色谱;无限稀释活度系数;溶解度参数;双阳离子型离子液体
中文版上肢技巧质量量表在脑性瘫痪患儿上肢功能评定中的信度和效度	王军;陈静;朱登纳;袁俊英;牛国辉;孙二亮;程萍萍	《中国康复医学杂志》	郑州大学第三附属医院小儿脑瘫康复中心;	2016	上肢技巧质量评估量表;上肢功能评定;痉挛型;脑性瘫痪;信度;效度
常见非发酵菌的临床分布及耐药性分析	王军;刘勇	《实用药物与临床》	中国医科大学附属盛京医院检验科;	2016	非发酵菌;医院感染;耐药率
沙粒粒径和外电位对黄铜腐蚀磨损的影响	王军军;李志均;黄伟九	《摩擦学学报》	重庆理工大学材料科学与工程学院;重庆理工大学重庆市模具技术重点试验室;重庆市制动摩擦材料协同创新中心;	2016	黄铜;沙粒粒径;外电位;冲蚀磨损
245/70R16轮胎的有限元分析	王军;李梁;孙林;沙昌新	《轮胎工业》	双钱集团上海轮胎研究所有限公司;	2016	轮胎;有限元分析;侧偏;侧倾;滚动温度场;滚动阻力场
身体活动流行病学研究的基本问题述评	王军利	《体育学刊》	中国矿业大学体育学院;	2015	进行精确检索;出版文献的检索时间截止;运动医学;身体活动;流行病学;剂量效应;述评
智能环境基于用户交互模态的情境感知服务	王军锋;余隋怀;IMRE Horvath;王宁	《计算机工程与应用》	西北工业大学工业设计研究所;西南科技大学制造科学与工程学院;代尔夫特理工大学工业设计工程学院;	2015	普适计算;智能环境;服务推送;情境感知;用户交互模态
基于室内热舒适能效的既有办公建筑绿色改造策略分析	王军亮;王清勤;喻伟;李国柱;袁扬	《暖通空调》	重庆大学;中国建筑科学研究院;	2015	室内热舒适能效;绿色改造;优化策略;建筑能耗;办公建筑
砂土-格栅筋土界面特性的本构模型研究	王军;林旭;符洪涛	《岩土力学》	温州大学建筑与土木工程学院;温州大学浙江省软弱土地基与海涂围垦工程技术重点实验室;连云港职业技术学院建筑工程学院;	2014	粗砂格栅界面;本构模型;峰值前;峰值后;剪胀性
外源ABA对低温胁迫下冬小麦细胞膜脂组分及膜透性的影响	王军虹;徐琛;苍晶;于晶;张成亮;王兴;王健飞;王祖建;苍炜	《东北农业大学学报》	东北农业大学生命科学学院;	2014	冬小麦;ABA;东农冬麦号;低温胁迫;膜质
面向机器人工程对象的“创新研究型实验”课程建设	王军;李明	《实验室研究与探索》	中国矿业大学信息与电气工程学院;	2013	机器人工程;创新研究型实验;创新人才培养;课程建设
新兴服务业生态网络中骨干企业创新采纳机理——一个探索性案例研究	王军;秦学志	《科研管理》	大连理工大学管理与经济学部;大连国际机场集团有限公司;	2012	服务创新;创新采纳;商业生态网络;新兴服务业
公交车实际道路颗粒物排放的数浓度特征	王军方;丁焰;尹航;谭建伟;张海燕;殷宝辉	《环境科学研究》	中国环境科学研究院;北京理工大学机械与车辆工程学院;	2012	车载排放测试系统(PEMS);颗粒物;粒径分布;数浓度
生气、高兴和伤心情境中幼儿情绪表达策略差异	王军利;王玲;吴东女;卢英俊	《应用心理学》	浙江师范大学杭州幼儿师范学院发展认知神经科学实验室;广西师范学院教育科学学院;华南师范大学增城学院;	2012	幼儿;情绪表达策略;情绪情境
短期国际资本流动新趋势、对我国的影响及其防范	王军	《经济与管理研究》	中国国际经济交流中心;	2011	短期国际资本流动;热钱;新兴经济体;资产价格;资产泡沫
EMS诱变谷子‘长农35号’M_1代成熟期株型突变体的鉴定与分析	王军;杨慧卿;袁峰;郭二虎	《中国农学通报》	山西省农科院谷子研究所;	2011	谷子;‘长农号’;甲基磺酸乙酯(EMS);突变体;株型
薄壁壳体件装夹变形机理有限元分析与控制	王军;耿世民;张辽远;吕玉山	《兵工学报》	沈阳理工大学机械工程学院;沈阳建筑大学交通与机械工程学院;	2011	机械制造工艺与设备;薄壁壳体件;装夹方案;有限元模拟;集中载荷;均布载荷
印度农业国内支持制度的完善及对我国的启示	王军杰	《农村经济》	四川大学法学院;	2011	印度农业;国内支持;启示
制定《网络问政促进法》之建议	王军	《法学杂志》	安徽省委党校法学部;	2010	网络问政;促进;立法
不同种植方式对烟田氮素径流损失的影响	王军;陈能场;詹振寿;谢玉华;吕永华;柯油松;徐胜光	《水土保持学报》	广西大学农学院;广东省烟草南雄科学研究所;广东省生态环境与土壤研究所;广东省烟叶生产购销公司;广东省烟草南雄市有限公司;	2010	种植方式;烟田;氮素;径流损失
机动车污染防治政策与管理	王军方;丁焰;汤大钢	《环境保护》	环境保护部机动车排污监控中心;	2010	机动车排放标准;机动车污染;污染物排放标准;环境保护;大气污染防治法;车用燃料;环保部门;消费税;环保管理;合格标志
N_1+N_2结构中的意念焦点	王军	《外语教学》	苏州大学外国语学院	2008	N+N结构;复合名词;中心词;意念焦点
水稻香米基因标记的开发与应用	王军;杨杰;陈志德;仲维功	《分子植物育种》	江苏省农业科学院粮食作物研究所	2008	水稻;香米基因;基因标记;开发和应用
英国法上的名誉权保护——以诽谤之诉为考察对象	王军;王轩	《法学杂志》	对外经济贸易大学	2008	诽谤之诉;抗辩理由;名誉权
效与公——深化我国收入分配制度改革的思考与建议(上)	王军	《经济研究参考》	财政部;	2008	收入分配差距;收入分配制度改革;调节收入分配;个人所得税;收入差距过大;基尼系数;转移支付;企业所得税;城镇居民;效率与公平
钢纤维再生混凝土的抗折强度试验研究	王军龙;肖建庄	《工业建筑》	西安铁路职业技术学院土木工程系	2007	再生粗集料;钢纤维再生混凝土;再生粗集料的含量;水灰比;抗折强度
冰塞水位分析	王军;付辉;伊明昆;尹运基;高月霞	《水科学进展》	合肥工业大学土木建筑工程学院	2007	冰塞;水位;直槽;弯槽
欧盟合同法律适用制度的演进	王军;王秀转	《清华法学》	对外经济贸易大学法学院	2007	欧盟;合同之债的法律适用;国际私法;条例
基于不完全非合作博弈的上市公司违规行为分析	王军伟	《财贸研究》	南京审计学院管理学院	2006	上市公司;违规行为;不完全博弈;非合作博弈;公司治理
国外政府间财政均衡制度的考察与借鉴	王军;贾康;祝小芳;项中新;张晓云	《财政研究》	 	2006	地方政府;均衡性;横向转移支付;政府间财政关系;制度设计;财政支出;公共服务均等化;澳大利亚;均衡分配;联邦政府
关于宏观税负与经济增长关系的探究	王军平	《山西财经大学学报》	中国人民大学公共管理学院	2005	非应税GDP;宏观税负;投入产出表
基于STEP-NC的CNC集成技术研究	王军;孙军;聂新刚;刘哲;王国勋	《沈阳建筑大学学报(自然科学版)》	沈阳建筑大学交通与机械工程学院	2005	数控;STEP;STEP-NC;制造特征;CNC
镍氢电池组的荷电状态估计方法研究	王军平;陈全世;林成涛	《机械工程学报》	西安交通大学机械工程学院	2005	镍氢电池组;荷电状态;卡尔曼滤波
宫井洋大黄鱼遗传多样性的RAPD分析	王军;全成干;苏永全;丁少雄;张纹	《海洋学报(中文版)》	厦门大学海洋学系亚热带海洋研究所!福建厦门361005	2001	大黄鱼;遗传多样性;PAPD
超声乳化透明晶状体吸除术治疗高度近视的临床研究	王军;施玉英	《中华眼科杂志》	首都医科大学附属北京同仁医院眼科	2001	近视;晶体;人工;屈光手术
面向快速智能设计的产品实例数据精简与重构	王军;张宗超;何平;李永欣;刘福林	《机械设计》	燕山大学机械工程学院;	2017	产品族基因;快速设计;知识重构;神经网络
不同临床分期湿疹患者外周血中IL-7和IL-10水平变化及其临床意义	王军;赵卫红;边鹊桥;王保占	《吉林大学学报(医学版)》	天津市第三中心医院皮肤性病科天津市肝胆疾病研究所天津市人工细胞重点实验室卫生部人工细胞工程技术研究中心	2018	湿疹;白细胞介素;白细胞介素;湿疹面积和严重程度指数
海杂波对机载雷达探测距离的影响	王军东	《电子测量技术》	中国飞行试验研究院	2018	探测距离;海杂波;折算
西安地区百日咳儿童临床特征及重症危险因素	王军;孙芳;刘瑞清;袁娟;张玉凤;徐鹏飞;张瑜;王小燕;邓慧玲	《中华实验和临床感染病杂志(电子版)》	西安市儿童医院感染二科	2018	百日咳;临床特征;危险因素
清澜港湿地沉积物中重金属赋存形态及生态风险	王军广;王鹏;伏箫诺;赵志忠;邱彭华;吴丹	《工业安全与环保》	海南师范大学地理与环境科学学院	2018	赋存形态;重金属;红树林沉积物;生态风险;清澜港
地震前兆数据库系统共享接口设计与实现	王军;李正媛;黄经国;刘春国;周克昌	《震灾防御技术》	中国地震台网中心	2018	地震前兆数据库;Oracle;数据交换接口
国内外体外诊断产品标准体系研究	王军;张宏;代蕾颖;王会如;卢民	《中国医疗器械杂志》	北京市医疗器械检验所	2018	体外诊断;标准;国际标准化组织;标准体系
新型城镇化进程中失地农民权益保障法律问题研究	王军力	《农业经济》	北京林业大学人文社会科学学院	2018	新型城镇化;失地农民;法律问题;权益保障
幽门螺旋杆菌感染合并代谢综合征与颈动脉内膜厚度的相关性研究	王军	《中国卫生统计》	重庆邮电大学医院	2018	颈动脉内膜厚度;幽门螺杆菌;代谢综合征
综合认知干预训练在缺血性脑卒中术后血管性认知障碍患者中的应用观察	王军;关欣;马春梅;王征	《护理学报》	首都医科大学宣武医院神经外科	2018	缺血性脑卒中;血管性认知障碍;认知干预;简易智能精神状态检查表;蒙特利尔认知评估量表;日常生活能力量表
东道国制度质量对中国OFDI的影响	王军;黄卫冬	《产业经济评论》	广东外语外贸大学;	2016	制度质量;一带一路;对外直接投资;东道国
社会信用体系建设视角下的信用成本博弈机制研究	王军富	《征信》	中国人民银行镇江市中心支行;	2016	社会信用体系;信用成本;博弈机制;中小企业融资
世界经济低速运行  复苏基础趋于稳固——2016年世界经济回顾及2017年展望	王军;郑泽香;张国洪;王磊;陈璇璇	《全球化》	国家统计局释经组;国家统计局国际统计信息中心;	2017	世界经济;低速运行;需求疲软;经济预测
金属玻璃流变的扩展弹性模型	王军强;欧阳酥	《物理学报》	中国科学院宁波材料技术与工程研究所中国科学院磁性材料与器件重点实验室浙江省磁性材料及其应用技术重点实验室;	2017	金属玻璃;流动;弹性模型
冬小麦‘东农冬麦1号’成熟胚组织培养及再生体系建立	王军虹;郑成成;于晶;卢秋巍;吴冰;朱会杰;冯明芳;梅琳;李维娜;褚丽阳	《东北农业大学学报》	东北农业大学生命科学学院;	2015	冬小麦;东农冬麦号;成熟胚;组织培养;再生体系
“亚投行”在突破TPP壁垒中的法律应对	王军杰	《山东警察学院学报》	四川大学法学院;	2015	亚投行;TPP;机制建构;争端解决
基于用户分群的超密集小区网络资源分配	王军选;汤仕艳;孙长印	《西安邮电大学学报》	西安邮电大学通信与信息工程学院;	2016	用户分群;资源分配;图论;信干噪比;干扰泄漏
性朴、性恶与向善:荀子人性学说的三个层次	王军	《现代哲学》	江苏科技大学人文社科学院;	2016	荀子;性朴;性恶;向善;诠释方法
除草剂草甘膦微生物降解技术研究进展	王军华;王易芬;陈蕾蕾;周庆新;杜方岭	《江苏农业科学》	山东省农业科学院农产品研究所;	2016	草甘膦;微生物降解;降解途径;原位修复
主产区猪肉价格波动与调控策略研究	王军;曹建民	《价格理论与实践》	吉林农业大学经济管理学院;	2016	猪肉价格;波动周期;政府调控;生猪产业链;规模养殖
我国污染源监测制度改革探讨	王军霞;陈敏敏;唐桂刚;景立新	《环境保护》	中国环境监测总站环境统计与污染源监测室;	2014	污染源监测;排污许可证;监督性监测;自行监测
水产品中多环芳烃的污染和健康风险评价模型研究进展	王军帅;钱卓真;吴萍萍;吴成业	《福建水产》	集美大学;福建省水产研究所;福建农林大学;	2015	多环芳烃;水产品;污染水平;健康风险评价;模型
复合结构黏弹性阻尼减振砂轮接杆的研究	王军;王加春;吴凤和;周勇;柏虎	《机械工程学报》	燕山大学机械工程学院;	2014	砂轮接杆;黏弹性阻尼;有限元;动态性能;复合结构
知识产权刑事司法保护的现实困境及其出路	王军明	《湖南师范大学社会科学学报》	吉林大学法学院;	2014	知识产权犯罪;司法困境;立法完善;刑事法治
基于拟时间函数的气井不稳定生产数据分析	王军磊;贾爱林;甯波;蒋俊超	《天然气工业》	中国石油勘探开发研究院;	2014	气井;线性流;探测边界;平均地层压力;拟时间;生产数据;裂缝长度
木质纤维/聚酯纤维吸声材料复合工艺的研究	王军锋;彭立民;傅峰;张耀丽;梁善庆	《南京林业大学学报(自然科学版)》	中国林业科学研究院木材工业研究所;南京林业大学材料科学与工程学院;	2013	木质纤维;聚酯纤维;吸声材料
网络信息对顾客价值感知的作用机理研究	王军;徐敏娟	《图书情报工作》	吉林大学管理学院;	2013	网络环境;信息;顾客心理;价值感知;购买决策
从国际法中的关键日期看钓鱼岛的主权归属	王军敏	《太平洋学报》	中共中央党校;	2013	关键日期;时际法;钓鱼岛
饲粮中添加苏氨酸和色氨酸对接种猪繁殖与呼吸综合征弱毒苗生长猪免疫反应的影响	王军;赵迎飞;方正锋;林燕;车炼强;杨敏;吴德	《动物营养学报》	四川农业大学动物营养研究所	2013	苏氨酸;色氨酸;PRRS弱毒苗;免疫反应;生长猪
现行黄曲霉毒素液相色谱检测法的比较与评价	王军淋;胡玲玲;蔡增轩;李劲;任一平	《食品安全质量检测学报》	浙江工业大学化学工程与材料学院;浙江省疾病预防控制中心;浙江大学药学院;	2013	三氟乙酸(TFA);光化学柱后衍生;大体积流动池;黄曲霉毒素;液相色谱
历史与主权——驳日本关于钓鱼岛主权的三项依据	王军杰	《四川大学学报(哲学社会科学版)》	四川大学法学院;	2012	钓鱼岛;主权;先占;时效
阿尔茨海默病早期诊断:影像学和体液生物标志物研究前沿和新动态	王军;张莹;郑妍鹏;王虹峥;李坤成;齐志刚;崔瑞雪	《中国医学前沿杂志(电子版)》	北京交通大学生命科学与生物工程研究院;北京协和医学院基础学院;首都医科大学宣武医院放射科;北京协和医院核医学科;	2012	生物标志物;CSF;β-淀粉样蛋白;FDG-PET;MRI
红外头盔式眼动仪的瞳孔中心定位算法	王军宁;刘涛;何迪;武媛媛	《西安电子科技大学学报》	西安电子科技大学通信工程学院;	2011	瞳孔中心定位;星射线;椭圆拟合;眨眼检测
检察案例指导制度相关问题研究	王军;卢宇蓉	《人民检察》	最高人民检察院;	2011	案例指导;制度价值;功能定位;法律效力
刑法“多次”从严根据论	王军仁	《烟台大学学报(哲学社会科学版)》	北京化工大学文法学院;	2010	刑法;多次规定;多次盗窃;多次抢劫;从严根据
亚热带常绿人工针叶林冠层内光能利用率	王军邦;张秀娟;韩海荣;吴楚	《生态学杂志》	中国科学院地理科学与资源研究所;北京林业大学;长江大学园艺园林学院;	2010	常绿针叶人工林;光能利用率;冠层
扰动情形下瓶颈利用对作业车间调度的影响	王军强;陈剑;翟颖妮;张松飞;杨建斌;孙树栋	《计算机集成制造系统》	西北工业大学系统集成与工程管理研究所;西北工业大学现代设计与集成制造技术教育部重点实验室;	2010	约束理论;瓶颈能力释放率;瓶颈能力释放区;作业车间调度问题;鲁棒性;随机扰动
美国金融危机对我国经济的影响及启示	王军;董方军	《中国城市经济》	特华博士后科研工作站;北京交通大学;	2009	金融危机;房地产市场;经济的;实体经济;经济危机;世界经济衰退;中国经济增长;美元危机;美国;信用
准噶尔盆地乌夏断裂带构造样式演化	王军;戴俊生;冯建伟;霍丽丽;申大媛	《西南石油大学学报(自然科学版)》	中国石油大学地球资源与信息学院;中国石油冀东油田分公司勘探开发研究院;中国石油辽河油田分公司勘探开发研究院;	2009	准噶尔盆地;乌夏断裂带;构造样式;发育序列;演化阶段;二叠纪;三叠纪;发育阶段;印支运动;生长背斜
超声速多喷流干扰流场特性研究	王军旗;李素循	《力学学报》	中国航天空气动力技术研究院;山东大学能源与动力工程学院;	2009	横向喷流;多喷流;超声速流;激波/边界层干扰
苯醚甲环唑在土壤中的降解动力学及其影响因子	王军;温家钧;边侠玲;花日茂;汤锋	《西北农业学报》	安徽省化工研究院;安徽农业大学资源与环境学院;国际竹藤网络中心;	2009	苯醚甲环唑;土壤;降解动态;影响因子
论回指语的概念重现	王军	《外语学刊》	苏州大学	2008	回指;回指语;先行语;重现
CT扫描  食管造影和内窥镜测量食管癌病变长度的价值	王军;祝淑钗;韩春;李晓宁;高超;赵玉芹;贾敬好	《中国肿瘤临床》	河北医科大学第四医院放疗科;	2008	食管癌;计算机体层摄影术;食管钡餐造影;内窥镜;长度
基于修正Masing准则的萧山软黏土动应力-应变关系研究	王军;陈张林;蔡袁强;徐长节	《岩石力学与工程学报》	浙江大学岩土工程研究所	2007	土力学;循环荷载;Masing准则;萧山软黏土
用筋膜学说解读经络实质和物质基础	王军;王春雷;沈宝林;杨林林;原林	《中国针灸》	南方医科大学人体解剖学教研室	2007	经络研究;经络实质;筋膜;中医现代化
20世纪美国黑人女性主义文学的发展与现状	王军	《西南大学学报(社会科学版)》	吉林师范大学外国语学院	2007	黑人文学;黑人女性主义文学与批评;后殖民主义批评;女性主义批评;美国黑人;女性主义文学批评;女性文学;黑人妇女;文艺批评;美国文学批评
混合型有源电力滤波器研究现状与发展趋势	王军华;李建贵;汪友华	《电气传动》	 	2007	谐波污染;电能质量;混合型有源电力滤波器;有源线路调节器
一种锅炉系统模型分析及其非线性控制	王军;李东海;薛亚丽	《中国电机工程学报》	清华大学热能动力仿真与控制研究所	2007	相对增益矩阵;非线性测度;间隔度量;反馈线性化;鲁棒稳定性
600MW超临界锅炉的调试及运行	王军;邓仲勇;李铁;何维;林正春	《动力工程》	东方锅炉(集团)股份有限公司	2006	动力机械工程;超临界锅炉;运行性能;燃烧优化;壁温分布
我国新闻侵权纠纷现状、对策及研究回顾	王军	《法学杂志》	中国传媒大学	2006	新闻侵权;回顾;研究
扰动结构性软土地基的沉降特性分析	王军;高玉峰	《岩土力学》	河海大学岩土工程研究所	2006	结构性;软土;扰动;应力水平;沉降特性
水杨酸诱导油茶抗炭疽病的研究	王军;陈绍红;黄永芳;孙思	《林业科学研究》	华南农业大学林学院	2006	水杨酸;油茶;炭疽菌;诱导抗性
基于GIS-T的交通管理综合信息平台的架构设计	王军利;朱茵;周海淞;于瑞华;李磊	《交通运输系统工程与信息》	中国人民公安大学交通管理工程系	2005	交通地理信息系统;交通管理;综合信息平台;构架设计
日本落叶松木材的化学组成研究	王军辉;张守攻;石淑兰;谭希文;程俊	《林业科学研究》	中国林业科学研究院林业研究所	2004	日本落叶松;木材;制浆造纸;化学组成
高速公路锚杆锚固质量无损检测技术研究	王军民;陈义群;陈华	《地球物理学进展》	中国地质大学(武汉)	2004	锚杆;锚固;无损检测;超磁
二甲戊乐灵在土壤中的吸附及微生物降解	王军;朱鲁生;林爱军;刘爱菊;孙瑞莲	《农业环境科学学报》	山东农业大学资源与环境学院	2003	二甲戊乐灵;吸附;土壤微生物;降解
陕西黄土高原小流域治理效益评价与模式选择	王军强;陈存根;李同升	《水土保持通报》	西北大学城市与资源学系	2003	小流域治理;多层次模糊综合评价法;模式选择;陕西黄土高原
我国税务行政诉讼制度及其完善	王军	《税务研究》	山东大学经济学院	2002	税务行政诉讼;税务机关;具体行政行为;税务行政复议;受案范围;税务当事人;《税收征收管理法》;《行政诉讼法》;诉讼制度;税务法院
保定市经济区域差异及区域协调发展研究	王军;梁红莲;张红菊	《经济地理》	保定师范专科学校资源与环境系	2002	保定市;区域差异;变差系数;增长极;发展战略;环京津经济圈
中国投资函数的实证分析	王军	《当代经济科学》	中央财经大学!北京100081	2001	投资;投资函数;适度投资规模
中国证券一级市场分析	王军波;邓述慧	《管理科学学报》	中国科学院系统科学研究所!北京100080	2000	证券一级市场;超额报酬率;认购中签率;发行量;发行价
Impacts of bridge piers on water level during ice jammed period in bend channel——An experimental study	王军;李淑祎;陈胖胖;汪涛;Jueyi Sui	《Journal of Hydrodynamics》	College	2018	Ice;jam;bend;channel;bridge;pier;increment;of;water;level
基于协方差矩阵稀疏表示的交互行为识别方法（英文）	王军;周思超;夏利民	《Journal of Central South University》	School	2018	交互识别;稠密轨迹;稀疏编码;多示例学习
上市公司重大资产重组否决原因——标的资产持续盈利能力探讨	王军辉;王海鹏;邓士丹	《中国资产评估》	沃克森(北京)国际资产评估有限公司	2018	重大资产重组;持续盈利能力;不确定性
精准扶贫下凉山州卫生人力资源发展现状研究	王军;陈巧玲;刘志会;刘国勇	《现代医院管理》	成都中医药大学	2018	精准扶贫;卫生人力资源;贫困地区
美国军队战场综合医疗信息系统的架构与运行	王军红;吴蓉;韩松	《人民军医》	济南军区总医院医学科技情报研究中心	2018	美国军队;医疗信息系统;战场
煤田勘查资料在双龙地区砂岩型铀矿调查选区中的应用	王军礼;曹惠锋;刘厚宁	《中国煤炭地质》	中陕核工业集团地质调查院有限公司	2018	煤田勘查资料;砂岩型铀矿;自然伽马;含煤盆地;铀矿调查
堆载作用下桩基受力特性分析	王军;马学宁	《铁道建筑》	兰州交通大学土木工程学院	2018	铁路桥梁;侧向堆载;数值计算;单桩基础;负摩阻力;桩顶变形
积极心理学视野下大学生创新倾向的培养策略——基于科技竞赛获奖和普通大学生创新倾向的差异分析	王军妮;王兰;柏松杉	《技术与创新管理》	西安科技大学学工部	2018	获奖学生;普通学生;创新倾向;培育策略
完全湍流剪切层对圆柱涡激振动特性的影响	王军雷;吴金星;丁林;任保增	《哈尔滨工业大学学报》	郑州大学化工与能源学院;低品位能源利用技术及系统教育部重点实验室(重庆大学);	2017	涡激振动;质量阻尼比;流固耦合;旋涡脱落;湍流剪切层
北京地区多层含水层中施工降水诱发地面沉降的实时预测	王军辉;陶连金;韩煊;周宏磊	《北京工业大学学报》	北京工业大学建筑工程学院;北京市勘察设计研究院有限公司;	2017	多层含水层;施工降水;地面沉降;弱透水层;释水率
桥墩影响下弯槽冰塞形成临界条件和冰厚变化的试验研究	王军;汪涛;李淑祎;陈胖胖	《水利学报》	合肥工业大学土木与水利工程学院;	2017	桥墩;冰塞;厚度;输冰能力;试验研究
