纳米出版及其应用研究进展	牛丽慧;欧石燕	《图书情报工作》	南京大学信息管理学院	2018	纳米出版;语义出版;知识表示
微出版及其应用探析	牛丽慧	《现代情报》	南京大学信息管理学院	2018	微出版;语义出版;知识表示
信息贫困形成的经济学机理及其援助制度的设计	牛丽慧	《山西大学》	 	2016	信息贫困;权利方法;信息资源配置;信息援助制度
基于商品评论的网购顾客满意度指标体系的构建与分析	牛丽慧;由丽萍	《网友世界》	山西大学经济与管理学院;	2013	网络购物;顾客满意度;评价
针对性护理干预在ICU气管插管非计划性拔管中的应用	牛丽慧	《中国现代药物应用》	山西省长治市首钢长钢职工总医院ICU;	2014	气管插管;非计划性拔管;针对性护理
图书馆服务研究的演进路径及前沿分析	牛丽慧	《晋中学院学报》	山西大学经济与管理学院;	2014	图书馆服务;CiteSpace;研究前沿;可视化
高扬党的旗帜  坚持党校姓党	牛丽慧	《求知》	中共天津市河东区委党校;	2016	党校建设;党校事业;干部教育;党校教师;纪律意识;从严治党;党校教育;执政使命;教风;成长规律;
女性保健知识	牛丽慧	《现代养生》	 	2011	乳腺癌;乳房保健;女性形体;长时间;可能性;保健知识;妇女;胸部;束缚力;专家
大数据研究的现状、热点演进与前沿分析	刘飞;牛丽慧;金昌博	《数字图书馆论坛》	新疆医科大学图书馆;山西大学经济与管理学院;广州医科大学;	2015	大数据;可视化;Map-Reduce;个人隐私
基于阿马蒂亚·森权利方法的信息贫困成因分析	相丽玲;牛丽慧	《情报科学》	山西大学经济与管理学院;	2016	信息贫困;权利方法;权利失败
知识管理思想的演化与评价	相丽玲;牛丽慧	《情报理论与实践》	山西大学经济与管理学院;	2015	知识管理;知识管理思想;演化过程;评价
信息贫困形成的经济学机理	相丽玲;牛丽慧	《图书馆理论与实践》	山西大学经济与管理学院;	2015	信息贫困;经济学;信息资源配置;信息权利
论公民信息权	相丽玲;牛丽慧	《现代情报》	山西大学经济与管理学院;	2014	公民;信息权;信息行为;救济
国内电石炉尾气净化与综合利用研究进展	刘安花;刘泰安;牛丽慧;钟文艳;孙学敏;杨小波;张志君;侯军	《广州化工》	青海盐湖工业股份有限公司;	2014	电石炉尾气;除尘净化技术;综合利用;研究进展
超宽带天线及其阵列的若干技术研究	王军会	《西安电子科技大学》	 	2015	平面单极子天线;带阻特性;差分天线;超宽带相控阵;紧耦合技术
软件定义物联网路由研究	王军锋	《华中科技大学》	 	2016	物联网;软件定义网络;路由;半实物仿真;协作通信;智能代理;多径
基于SSH框架的石河子市电子政务网站的设计与实现	王军	《吉林大学》	 	2016	电子政务网站;JSP技术;B/S结构;SSH框架;MySQL
鸭源禽流感病毒的分离鉴定及其聚合酶活性研究	王军政	《吉林农业大学》	 	2015	鸭;禽流感;分离鉴定;聚合酶
中国低生育水平下的生育意愿与生育行为差异研究	王军;王广州	《人口学刊》	中山大学社会学与人类学学院;中国社会科学院人口与劳动经济研究所;	2016	低生育水平;全面两孩;生育意愿;生育行为
法律规避行为及其裁判方法	王军	《中外法学》	中国政法大学;	2015	规避法律;虚伪表示;名不副实;变相;以合法形式掩盖非法目的
出租汽车经营行政许可之合宪性分析	王军	《行政法学研究》	中国政法大学;	2016	出租汽车行业;行政许可;网约车;合宪性;比例原则
条约体制下近代中朝贸易关系研究（1840-1918）	王军有	《延边大学》	 	2017	条约体制;朝贡体制;朝鲜;贸易关系
中国土地整治文献分析与研究进展	王军;钟莉娜	《中国土地科学》	国土资源部土地整治中心土地整治重点实验室;中国地质大学(北京)土地科学技术学院;	2016	土地整治;文献分析;综述;研究进展;中国
土地整治工作中生态建设问题及发展建议	王军;钟莉娜	《农业工程学报》	国土资源部土地整治中心土地整治重点实验室;中国地质大学(北京)土地科学技术学院;	2017	土地整治;土地利用;生态;战略导向
中国城镇劳动力延迟退休意愿及其影响因素研究	王军;王广州	《中国人口科学》	中山大学社会学与人类学学院;中国社会科学院人口与劳动经济研究所;	2016	退休制度;延迟退休;理想退休年龄;养老金
苏北地区日光温室构型优化、室内温湿度分析及应用效果初探	王军伟	《南京农业大学》	 	2015	日光温室;结构优化;室内环境;后墙
绿色税收政策对经济增长的数量与质量效应——兼议中国税收制度改革的方向	王军;李萍	《中国人口·资源与环境》	西南财经大学经济学院	2018	绿色税收政策;经济增长;环境分权;税改
MIF,TGFβ,IFNγ基因多态性与脊柱结核易感性及在椎间盘中的表达与其临床资料的关联研究	王军	《广西医科大学》	 	2017	细胞因子;椎间盘;脊柱结核;炎症反应;基因多态性
制度变迁对中国经济增长的影响——基于VAR模型的实证研究	王军;邹广平;石先进	《中国工业经济》	首都经济贸易大学经济学院;	2013	制度变迁;经济增长;熵值法;VAR模型
土地利用变化对生态系统服务的影响研究综述	王军;顿耀龙	《长江流域资源与环境》	国土资源部土地整治中心/国土资源部土地整治重点实验室;中国地质大学(北京)土地科学技术学院;	2015	土地利用变化;土地利用空间格局;生态效应;生态系统服务
中国育龄人群的生育意愿及其影响估计	王军;王广州	《中国人口科学》	中国社会科学院人口与劳动经济研究所;	2013	生育意愿;意愿生育水平;人口规模;育龄人群
基于ZigBee的智能停车场管理系统的研究	王军宇	《吉林建筑大学》	 	2017	智能化停车场;ZigBee;CC2530;超声波
景观生态学在土地整治中的应用研究进展	王军;钟莉娜	《生态学报》	国土资源部土地整治中心土地整治重点实验室;中国地质大学(北京)土地科学技术学院;	2017	土地整治;景观生态效应;生态系统服务;生态安全
新常态下中国经济增长动力新解——基于“创新、协调、绿色、开放、共享”的测算与对比	王军;李萍	《经济与管理研究》	西南财经大学经济学院;	2017	新常态;经济增长;五大发展理念;动力分解;趋同检验
生育政策调整对中国出生人口规模的影响——基于生育意愿与生育行为差异的视角	王军	《人口学刊》	中山大学社会学与人类学学院;	2015	生育政策;生育意愿;生育行为;出生人口规模
组织即兴的形成机制研究:基于社会网络和组织学习理论	王军;曹光明;江若尘	《外国经济与管理》	上海财经大学国际工商管理学院;中国科技大学管理学院;徽商银行博士后工作站;上海财经大学上海发展研究院;	2016	组织即兴;社会网络嵌入;组织学习
生物炭对退化蔬菜地土壤及其修复过程中N_2O产排的影响	王军;施雨;李子媛;韩成;谢祖彬;钟文辉	《土壤学报》	江苏省物质循环与污染控制重点实验室南京师范大学;山东省水土保持与环境保育重点实验室;中国科学院南京土壤研究所;	2016	NO排放;生物炭;退化设施蔬菜地;土壤修复;环境效应;反硝化微生物
民营企业慈善捐赠与财务绩效的因果关系研究——基于政治关联性与市场化程度调节效应的分析	王军;郑玲;江若尘	《山西财经大学学报》	上海财经大学国际工商管理学院;上海财经大学上海发展研究院;	2016	民营企业慈善捐赠;财务绩效;政治关联性;市场化程度
松嫩平原西部土地整理对盐渍化土壤的改良效果	王军;顿耀龙;郭义强;窦森	《农业工程学报》	国土资源部土地整治中心土地整治重点实验室;中国地质大学(北京)土地科学技术学院;吉林农业大学资源与环境学院;	2014	土壤;盐分;肥;土地整理;典范对应分析;松嫩平原
实践重塑规则:有限公司股权转让限制规范检讨	王军	《中国政法大学学报》	中国政法大学;	2017	有限责任公司;股权转让;限制规则;准许程序;优先购买权
新型防淤堵真空预压法室内与现场试验研究	王军;蔡袁强;符洪涛;林统;叶强;金亚伟;陈兴城	《岩石力学与工程学报》	温州大学建筑与土木工程学院;温州大学浙江省软弱土地基与海涂围垦工程技术重点实验室;温州市水文站;宜兴市鑫泰土工材料有限公司;江西理工大学建筑与测绘工程学院;	2014	土力学;吹填土;直排式真空预压;新型防淤堵真空预压;加固效果;防淤堵机制
基于反S函数的盐岩单轴压缩全过程蠕变模型	王军保;刘新荣;宋战平;赵宝云;蒋斌;黄天柱	《岩石力学与工程学报》	西安建筑科技大学土木工程学院	2018	岩石力学;盐岩;蠕变特性;稳态蠕变率;长期强度;反S函数;蠕变模型
盐岩蠕变特性及其非线性本构模型	王军保;刘新荣;郭建强;黄明	《煤炭学报》	西安建筑科技大学土木工程学院;重庆大学土木工程学院;福州大学土木工程学院;	2014	盐岩;蠕变特性;非线性模型;参数识别
中国流域生态补偿机制实施框架与补偿模式研究——基于补偿资金来源的视角	王军锋;侯超波	《中国人口.资源与环境》	南开大学环境科学与工程学院;天津市循环经济与低碳发展人文社科研究基地;	2013	流域生态补偿机制;补偿资金;补偿模式
一致性与矛盾性在线评论对消费者信息采纳的影响研究——基于感知有用性的中介作用和自我效能的调节作用	王军;周淑玲	《图书情报工作》	吉林大学管理学院;	2016	在线评论;感知有用性;信息采纳;自我效能
区域特有农产品品牌整合的政府行为研究——以长白山人参品牌为例	王军;李鑫	《农业经济问题》	吉林大学管理学院;	2014	区域特有农产品;品牌整合;政府行为;长白山人参
基于复杂自适应Petri网的棉纺生产预报模型及其优化	王军	《东华大学》	 	2016	棉纺虚拟制造;复杂自适应Petri网;系统复杂度;两步过滤算法;指标分类及降维;人工神经网络;GA-BP算法;多智能体系统
论“一带一路”沿线投资政治风险的法律应对	王军杰	《现代法学》	四川大学法学院	2018	一带一路;政治风险;法律应对
从国家计划到生育自主:中国人口政策的未来趋向	王军;贾晓菲	《青年探索》	中山大学社会学与人类学学院	2018	计划生育;生育政策;人口政策;生育自主;低生育陷阱
土地整治对生态系统服务影响研究综述	王军;钟莉娜;应凌霄	《生态与农村环境学报》	国土资源部土地整治中心/国土资源部土地整治重点实验室	2018	土地整治;生态系统服务;协同/权衡关系;尺度效应
真空预压–电渗法联合加固软黏土地基试验研究	王军;张乐;刘飞禹;符洪涛	《岩石力学与工程学报》	温州大学建筑与土木工程学院;温州大学浙江省软弱土地基与海涂围垦工程技术重点实验室;上海松江新城投资建设有限公司;上海大学土木工程系;	2014	基础工程;真空预压;电渗法;土体电阻;土体电导率;土体p;H值
关于学生体质健康测试中存在问题的思考	王军利	《体育学刊》	中国矿业大学体育学院;	2015	学校体育;学生体质健康;体质健康测试
开采沉陷动态预测模型	王军保;刘新荣;刘小军	《煤炭学报》	西安建筑科技大学土木工程学院;重庆大学土木工程学院;	2015	开采沉陷;改进的Knothe时间函数;下沉盆地;动态预测
碳排放权交易市场碳配额价格关联机制研究——基于计量模型的关联分析	王军锋;张静雯;刘鑫	《中国人口.资源与环境》	南开大学环境科学与工程学院;	2014	碳排放配额;碳排放核证减排量;脉冲响应函数;价格管理
基于遥感-过程耦合模型的1988～2004年青海三江源区净初级生产力模拟	王军邦;刘纪远;邵全琴;刘荣高;樊江文;陈卓奇	《植物生态学报》	中国科学院地理科学与资源研究所;	2009	青海;三江源;净初级生产力;遥感-过程模型
贸易和环境研究的现状与进展	王军	《世界经济》	南京审计学院经济系	2004	贸易;环境;国际环境合作;“搭便车”行为
含羧基结构聚酰亚胺及其化学接枝改性聚合物的制备与性能研究	王军	《吉林大学》	 	2017	聚酰亚胺;可溶解性;热稳定性;改性;荧光;介电性质
有机和无机肥配比对黄褐土硝化和反硝化微生物丰度及功能的影响	王军;申田田;车钊;董召荣;金鑫;曹文超;吴小文;宋贺	《植物营养与肥料学报》	安徽农业大学农学院/农业部黄淮南部小麦生物学与遗传育种重点试验室	2018	有机无机肥配比;黄褐土;硝化势;氨氧化细菌;氨氧化古菌;反硝化能力;反硝化菌群
在线评论有用性与时间距离和社会距离关系的研究	王军;丁丹丹	《情报理论与实践》	吉林大学管理学院;	2016	在线评论;用户评论;时间距离;社会距离
多维视野下的网络战:缘起、演进与应对	王军	《世界经济与政治》	中央民族大学中国民族理论与政策研究院;	2012	互联网;网络战;信息安全;社会网络战
气候变化经济学的文献综述	王军	《世界经济》	南京审计学院经济发展研究中心;	2008	气候变化;斯特恩报告;国际环境协议;机制设计理论
“互联网+”背景下精准扶贫新方式研究	王军;吴海燕	《改革与战略》	武汉科技大学马克思主义学院;	2016	精准扶贫;互联网+;大数据
运动疗法对我国原发性高血压干预效果的meta分析	王军威;袁琼嘉;杨澎湃;单继新;原江涛;宋广闻;江玉	《中国康复医学杂志》	成都体育学院运动医学系;成都体育学院运动系;	2017	原发性高血压;高血压患病率;meta分析;中老年高血压;现状报告;运动疗法;运动强度;运动频率;训练周期;运动处方;
城市地下综合管廊建设的困境与对策分析	王军;潘梁;陈光;李明;温修春	《建筑经济》	江苏大学土木工程与力学学院;光铭FM&BIM研究院;中国中铁四局四公司;	2016	地下空间;综合管廊;建设模式;困境;对策
政府研发补贴对企业创新以及经济增长的影响——理论依据与政策选择	王军;张一飞	《经济社会体制比较》	首都经济贸易大学经济学院;	2016	政府研发补贴;“挤出效应”;经济增长
氮化物深紫外LED研究新进展	王军喜;闫建昌;郭亚楠;张韵;田迎冬;朱邵歆;陈翔;孙莉莉;李晋闽	《中国科学:物理学 力学 天文学》	中国科学院半导体研究所;中国科学院半导体照明研发中心;半导体照明联合创新国家重点实验室;	2015	AlN;GaN;AlGaN;紫外发光二极管
沿空留巷巷旁支护参数分析与钢管混凝土墩柱支护技术研究	王军;高延法;何晓升;黄万朋;高琨鹏;杨柳;冯绍伟	《采矿与安全工程学报》	中国矿业大学(北京)力学与建筑工程学院	2015	巷旁支护参数;钢管混凝土墩柱;承载力试验;沿空留巷
土地整理的生态系统服务价值评估与生态设计策略——以吉林省大安市土地整理项目为例	王军;严慎纯;余莉;张亚男	《应用生态学报》	国土资源部土地整治中心/国土资源部土地整治重点实验室;中国地质大学土地科学技术学院;北京地亿时代土地规划设计有限公司;	2014	土地整理;尺度效应;生态服务价值;景观生态设计
岩石弹塑性应力-渗流-损伤耦合模型研究(Ⅰ):模型建立及其数值求解程序	王军祥;姜谙男;宋战平	《岩土力学》	大连海事大学道路与桥梁工程研究所;西安建筑科技大学土木工程学院;	2014	弹塑性损伤本构模型;渗透系数;弹塑性应力-渗流-损伤耦合模型;损伤参数反演
土地整理的景观格局与生态效应研究综述	王军;严慎纯;白中科;余莉;郭义强	《中国土地科学》	国土资源部土地整治中心土地整治重点实验室;中国地质大学(北京)土地科学与技术学院;北京地亿时代土地规划设计有限公司;	2012	土地整理;景观格局;生态效应
公共危机状态下政府对媒体过度管理问题研究	王军艳	《吉林大学》	 	2017	公共危机;媒体管理;过度管理
身体规训与生成:青少年体育锻炼不足的学校体育实践反思	王军利	《中国青年研究》	中国矿业大学体育学院体育科学实验中心;	2018	青少年;身体;体育锻炼;课程
碳量子点激发依赖荧光特性的机理、调控及应用	王军丽;王亚玲;郑静霞;于世平;杨永珍;刘旭光	《化学进展》	太原理工大学新材料界面科学与工程教育部重点实验室	2018	碳量子点;激发依赖;表面态;粒径分布;碳核结构
北疆膜下滴灌棉花产量及水分生产率对灌水量响应的模拟	王军;李久生;关红杰	《农业工程学报》	中国水利水电科学研究院流域水循环模拟与调控国家重点实验室;北京林业大学水土保持学院;	2016	棉花;模型;灌溉;膜下滴灌;作物生长模型;水分生产率;耦合
稀土Ce和Y对AZ80镁合金组织和力学性能的影响	王军;朱秀荣;徐永东;王荣;聂景江;张立君	《中国有色金属学报》	中国兵器科学研究院宁波分院;	2014	AZ镁合金;Ce;Y;挤压变形;时效强化
可扩展制造执行系统软件体系结构设计与实现	王军强;周雪明;郭银洲;杨宏安;张映锋;孙树栋	《计算机集成制造系统》	西北工业大学生产与运作系统性能分析中心;西北工业大学现代设计与集成制造技术教育部重点实验室;	2014	可扩展制造执行系统;工厂方法模式;软件体系架构;航空制造业
我国来华留学生教育的基本定位与应对策略	王军	《中国高教研究》	山东大学国际教育学院;	2014	高等教育;国际化;教育输出;来华留学生;预备教育
技术进步带来了就业质量的提升吗?——基于中国2000～2016年省级动态面板数据分析	王军;詹韵秋	《云南财经大学学报》	西南财经大学经济学院	2018	就业质量;技术进步;机制构建
电液伺服技术的发展与展望	王军政;赵江波;汪首坤	《液压与气动》	北京理工大学自动化学院	2014	电液伺服系统;电液伺服阀;发展趋势
曲拉热风干燥工艺参数筛选及色泽品质评价	王军;王琳琳;韩玲;丁考仁青;文鹏程;丁福军	《农业工程学报》	甘肃农业大学食品科学与工程学院;甘南州畜牧科学研究所;甘肃华羚酪蛋白股份有限公司;	2014	热风干燥;品质控制;优化;曲拉;参数筛选;品质评价;响应面
城市地下综合管廊建设及运营现状	王军;陈欣盛;李少龙;陈光;潘梁	《土木工程与管理学报》	江苏大学土木工程与力学学院	2018	地下空间;综合管廊;建设模式;运营管理;对策
基于生态系统服务价值的土地整理对生态连通性的影响——以吉林省大安市土地整理项目为例（英文）	王军;严慎纯;郭义强;李俊然;孙国庆	《Journal of Geographical Sciences》	Key	2015	land;consolidation;project;ecological;connectivity;ecosystem;service;value;landscape;pattern;landscape;function;Da'an;city
致密气藏分段压裂水平井产量递减规律及影响因素	王军磊;贾爱林;何东博;位云生;齐亚东	《天然气地球科学》	中国石油勘探开发研究院;	2014	致密气;多裂缝;压力叠加;产量递减;正交试验;有效开采年限
孩次结构与中国出生性别比失衡关系研究	王军;郭志刚	《人口学刊》	中国社会科学院人口与劳动经济研究所;北京大学社会学系;	2014	出生性别比;孩次结构;生育水平
继续解放思想  坚持科学发展  实现从会计大国向会计强国的迈进	王军	《会计研究》	财政部;	2012	会计标准;会计行业;解放思想;会计师事务所;注册会计师行业;会计人才;科学发展;会计工作;会计改革;改革创新
土地整理对生态环境影响的研究进展与展望	王军;李正;白中科;鞠正山;王国茹	《农业工程学报》	国土资源部土地整治重点实验室;中国地质大学土地科学技术学院;郑州市绿化工程管理处;	2011	生态;环境影响;土壤;土地整理
政府主导型流域生态补偿机制研究——对子牙河流域生态补偿机制的思考	王军锋;侯超波;闫勇	《中国人口.资源与环境》	南开大学环境科学与工程学院;	2011	子牙河;政府主导;生态补偿基金;流域生态补偿机制
短期增温对紫花针茅草原土壤微生物群落的影响	王军;王冠钦;李飞;彭云峰;杨贵彪;郁建春;周国英;杨元合	《植物生态学报》	中国科学院植物研究所植被与环境变化国家重点实验室;中国科学院大学;中国科学院西北高原生物研究所藏药研究重点实验室;	2018	气候变暖;磷脂脂肪酸;微生物群落;青藏高原;高寒草原
“整体复建”重创后的古城复兴路径探索——以大同古城为例	王军	《城市发展研究》	中国城市规划设计研究院名城所;	2016	整体复建;拆旧建新;网络修补;真实性;本土化
岩石弹塑性损伤本构模型建立及在隧道工程中的应用	王军祥;姜谙男	《岩土力学》	大连海事大学道路与桥梁工程研究所;大连海事大学辽宁省公路工程重点实验室;	2015	孔隙水压力;弹塑性损伤本构模型;修正有效应力原理;Drucker-Prager屈服准则;隐式返回映射算法;反分析方法
乌克兰危机的民族政治解读	王军	《国际安全研究》	中央民族大学中国民族理论与民族政策研究院;	2014	乌克兰危机;民族政治;民族自决;政党政治
基于蚂蚁体各向异性的裂缝表征方法	王军;李艳东;甘利灯	《石油地球物理勘探》	中国石油勘探开发研究院;	2013	蚂蚁体;蚂蚁追踪;方位各向异性;裂缝检测
基于染色体单片段代换系的水稻粒形QTL定位	王军;朱金燕;周勇;杨杰;范方军;李文奇;梁国华;仲维功	《作物学报》	江苏省农业科学院粮食作物研究所/国家水稻改良中心南京分中心;扬州大学农学院/江苏省遗传生理重点实验室/教育部植物功能基因组学重点实验室;	2013	水稻;单片段代换系;数量性状;粒形;代换作图
生育政策和社会经济状况对中国出生性别比失衡的影响	王军	《人口学刊》	中国社会科学院人口与劳动经济研究所;	2013	生育政策;社会经济;出生性别比;分层
中国农民专业合作社社员机会主义行为的约束机制分析	王军	《中国农村观察》	北京商业管理干部学院合作经济研究中心;	2011	农民专业合作社;机会主义行为;约束机制
基于GIS的土地整理景观效应分析	王军;邱扬;杨磊;邸超;余莉	《地理研究》	国土资源部土地整理中心国土整治研究室	2007	土地整理;景观生态学;景观效应指标;GIS
喷涂聚脲加固粘土砖砌体抗动载性能试验研究及数值分析	王军国	《中国科学技术大学》	 	2017	爆炸加载;砌体墙;粘土砖;聚脲弹性体;动力响应;加固机理;有限元分析
甘草酸预处理对大鼠心肌缺血再灌注损伤的保护作用及Bcl-2和Bax表达的影响	王军;张虹;谢凤杰;李海红	《中国实验方剂学杂志》	海南医学院第一附属医院;牡丹江医学院附属红旗医院;	2018	甘草酸;心肌缺血再灌注损伤;凋亡;B细胞淋巴瘤/白血病-原癌基因(Bcl-);Bcl-相关X蛋白(Bax)
公共企事业单位信息公开:依据、路径与标准	王军	《中国行政管理》	华东师范大学法学院	2018	公共企事业单位;政府信息公开;参照;自治
中国省级区域创新经济效率的实证分析	王军	《经济问题探索》	中国石油大学(华东)经济管理学院	2018	区域;创新;创新效率;数据包络方法
“社区卫生服务中心的发展之路”专家主题研讨	王军;张智慧;王兵兵;李玉红;刘莹;宋宝琦;赵艳芙;梁红;李雅楠;杨召;刘伟艳;吕晶	《中国全科医学》	长春市卫生和计划生育委员会基层卫生处;长春市朝阳区社区卫生服务管理中心;长春市朝阳区南湖第二社区卫生服务中心;长春市朝阳区前进社区卫生服务中心;长春市朝阳区重庆社区卫生服务中心;长春市二道区吉林社区卫生服务中心;长春市二道区东站社区卫生服务中心;长春市二道区东盛社区卫生服务中心;长春市二道区荣光社区卫生服务中心;长春市朝阳区永昌社区卫生服务中心;长春市二道区社区卫生服务管理中心;	2017	社区卫生服务;卫生服务管理;医师;家庭
论海洋油污损害赔偿责任的社会化分担	王军;张海枫	《比较法研究》	对外经济贸易大学法学院;	2017	海洋油污;风险分担;环境保护;强制保险;油污基金
传统村落保护的动态监控体系建构研究	王军;夏健	《城市发展研究》	苏州市规划编研中心;苏州国家历史文化名城保护研究院;	2016	传统村落保护;动态监控;体系建构
